{
  "schema_version": "2026-08-25.maplab-directional-map.v1",
  "scope": {
    "title": "MAPLAB 非投資域指向性治理地圖",
    "included": ["MAPLAB A0-A8", "Mac mini", "Windows", "Claude/Codex/Antigravity/Hermes/GPT/OpenClaw", "A2-A8 workflows", "Sheets/Drive/local indexes", "governance evidence"],
    "excluded": ["Investment OS roles, workflows, positions, research, databases and runtime details"],
    "last_verified": "2026-08-25"
  },
  "views": [
    {"id": "overview", "title": "系統總圖", "question": "Owner、硬體、代理、角色、資料與出口怎麼連？"},
    {"id": "repositories", "title": "Repo／地址", "question": "正式來源、狀態檔、生成器和 freshness 在哪裡？"},
    {"id": "roles", "title": "角色與派工", "question": "誰負責、誰協作、應召喚哪個角色？"},
    {"id": "workflows", "title": "A2–A8 工作流", "question": "每個專業角色如何把輸入變成可驗收輸出？"},
    {"id": "artifacts", "title": "產物血緣", "question": "Sheet、brief、素材、文章、報價、影片和 receipt 如何互用？"},
    {"id": "capabilities", "title": "能力／工具／硬體", "question": "哪台機器、哪個代理和哪個工具可做哪些步驟？"},
    {"id": "governance", "title": "治理／記憶／證據", "question": "現況、任務、版本、教訓與完成證據分別由誰管理？"}
  ],
  "repositories": [
    {"id": "repo:maplab", "name": "maplab-ai-handbook", "status": "verified", "description": "MAPLAB 規則、角色、工作流、Extension、生成器與 review receipts 的 canonical repo。", "path": "/Users/pagemacmini/maplab-ai-handbook", "owner": "A1", "inputs": ["Owner decisions", "runtime/UI readback", "task receipts"], "outputs": ["CURRENT_STATUS", "Task Cards", "role modules", "system maps"], "freshness": "git commit + manifest hash"},
    {"id": "repo:maplab-workspace", "name": "MAPLAB_WORKSPACE", "status": "verified", "description": "固定的大型輸出、狀態、工具與素材索引根目錄；不是治理真相源。", "path": "/Volumes/MacExternal/MAPLAB_WORKSPACE", "owner": "A1/A4", "outputs": ["outputs", "state", "tools", "index"], "freshness": "artifact receipts"},
    {"id": "repo:investment-os", "name": "Investment OS", "status": "excluded", "description": "本輪只保留邊界標記，不畫投資角色、資料或 runtime 關係。", "path": "/Users/pagemacmini/investment-os", "owner": "B roles"}
  ],
  "hardware": [
    {"id": "hardware:mac-mini", "name": "Mac mini", "status": "verified", "description": "主 repo、Git、launchd、Telegram bot、Ollama、控制面、生成器與 receipts 所在。", "owner": "A1", "outputs": ["generated maps", "runtime readback", "commits"]},
    {"id": "hardware:windows", "name": "Windows 工作機", "status": "declared", "description": "跨機器素材、剪輯與 UI 工作面，由 Chrome Remote Desktop／bridge 管理；每次仍需 live heartbeat 或畫面反讀。", "owner": "A0/A4", "outputs": ["asset/video/UI evidence"], "boundary": "Windows 證據須回 Mac canonical repo 留 receipt"},
    {"id": "hardware:cloud", "name": "Google／WordPress／Social SaaS", "status": "verified", "description": "Drive、Sheets、WordPress、Google Ads、Meta、YouTube 等外部工作面。", "owner": "A0/A1 + specialist role", "boundary": "發布、廣告變更、權限與外部寫入各自需要 approval/readback"}
  ],
  "runtimes": [
    {"id": "runtime:claude", "name": "Claude", "status": "verified", "description": "A0 Cowork 跨系統調度與 A1 Claude Code 治理／工程能力。", "owner": "A0/A1", "inputs": ["Task Card", "repo sources"], "outputs": ["dispatch", "governance changes", "review"]},
    {"id": "runtime:codex", "name": "Codex", "status": "verified", "description": "有界實作、測試、審查、可重建產出與 scoped commit。", "owner": "A1", "inputs": ["bounded task", "canonical sources"], "outputs": ["code", "tests", "receipt"]},
    {"id": "runtime:antigravity", "name": "Antigravity", "status": "declared", "description": "第二讀、SEO／廣告巡檢與候選執行節點。", "owner": "A0/A1", "boundary": "未驗證 ExecutionLease 前不得升格為任意寫入者"},
    {"id": "runtime:hermes", "name": "Hermes", "status": "verified", "description": "受限 Telegram 值班與文字判讀能力；依注入手冊回答。", "owner": "A1", "boundary": "不能把人設或回覆當作檔案、雲端或 runtime readback"},
    {"id": "runtime:gpt", "name": "GPT／ChatGPT", "status": "verified", "description": "內容、推理與第二讀能力，由角色契約與驗證 gate 約束。", "owner": "specialist role", "boundary": "模型建議不是現況證據"},
    {"id": "runtime:openclaw", "name": "OpenClaw", "status": "declared", "description": "瀏覽器 operator／worker 路徑；能力需按工作流逐案認證。", "owner": "A1", "boundary": "不得自我宣告 PASS；必須產出契約化檔案與 supervisor receipt"}
  ],
  "roles": [
    {"id": "role:Owner", "name": "Owner", "status": "verified", "description": "定方向、品牌、花錢、發布、權限與高風險核准。", "outputs": ["priority", "approval", "correction"]},
    {"id": "role:A0", "name": "A0 總調度秘書", "status": "verified", "description": "跨系統橋接、Owner 入口、派工、存檔監督與 Windows 遠端監控。", "path": "AGENT_RULES.md", "outputs": ["dispatch brief", "cross-system handoff"]},
    {"id": "role:A1", "name": "A1 系統總管", "status": "verified", "description": "repo 內治理、Task Card、巡查、debug、版本、生成器和證據收斂。", "path": "recalls/A1_recall.md", "outputs": ["task routing", "commit", "status writeback", "receipt"]},
    {"id": "role:A2", "name": "A2 搜尋流量作戰部", "status": "verified", "description": "SEO、WordPress、GSC／GA、案例內容與搜尋流量。", "path": "projects/seo-ads-agent.md", "inputs": ["brand facts", "A3 metrics", "A4 assets"], "outputs": ["case brief", "article", "landing page", "SEO metadata"]},
    {"id": "role:A3", "name": "A3 社群與廣告成長部", "status": "verified", "description": "Meta／Google Ads 成效、社群節奏、受眾、素材與漏斗。", "path": "projects/maplab-ads-monitor.md", "inputs": ["A2 landing", "A4 assets", "platform metrics"], "outputs": ["performance readback", "creative direction", "budget proposal"]},
    {"id": "role:A4", "name": "A4 影像資產整理部", "status": "verified", "description": "Drive 素材分類、授權／隱私、命名、標籤、ALT 與索引。", "path": "projects/maplab-pipeline.md", "inputs": ["raw assets", "case metadata"], "outputs": ["asset index", "approved asset pack"]},
    {"id": "role:A5", "name": "A5 報價與提案引擎部", "status": "verified", "description": "Items、成本、毛利、公式、條款與報價模板真相。", "path": "projects/maplab-master-data.md", "inputs": ["structured demand", "Items", "cost/margin rules"], "outputs": ["quote payload", "pricing validation", "proposal data"]},
    {"id": "role:A6", "name": "A6 業務快反應部隊", "status": "verified", "description": "依 A5 真相與 A4 素材快速組報價、提案與安全回覆。", "path": "skills/a5-quotation-engine-skills.md", "inputs": ["A7 demand", "A5 rules", "A4 assets"], "outputs": ["quote draft", "Slides proposal", "customer-safe reply"]},
    {"id": "role:A7", "name": "A7 客服與對話轉單部", "status": "verified", "description": "客戶詢問分類、標準回覆、需求結構化與轉單。", "path": "projects/ai-reply-system.md", "inputs": ["LINE/conversation"], "outputs": ["structured intake", "urgent route", "FAQ/market insight"]},
    {"id": "role:A8", "name": "A8 影音內容產線", "status": "verified", "description": "案例 brief 與素材轉歌詞、音軌、影片版本、發布包與平台 receipt。", "path": "skills/a8-video-pipeline-skills.md", "inputs": ["A2 brief", "A3 cadence", "A4 asset pack"], "outputs": ["lyrics package", "audio track", "platform videos", "publish package"]}
  ],
  "data_sources": [
    {"id": "data:maplab-sheet", "name": "MAPLAB 外燴系統主表", "status": "verified", "description": "Task Board、Owner Actions、Items、QUOTE_DRAFT、CONVERSATION_LOG 等營運資料入口。", "path": "google-sheet:1fn_woqYI_RY9ggGHVidB5SMygAzwe4CL_SOPLhe91Jg", "owner": "A5/A1", "used_by": ["A0", "A1", "A5", "A6", "A7"], "boundary": "Sheet 是營運資料真相，不等於 runtime 或完成證據", "freshness": "live Sheets readback"},
    {"id": "data:asset-log", "name": "MAPLAB_ASSET_LOG", "status": "verified", "description": "素材 file_id、原名、SEO 名、分類、關鍵字、ALT、Drive URL、年份。", "path": "google-sheet:1nlxlMdaLdGEAmOjP70BYspRWqu_eYpsiRyZaujEZkYI", "owner": "A4", "used_by": ["A2", "A3", "A4", "A6", "A8"], "outputs": ["asset lineage", "approved asset lookup"], "freshness": "Sheet readback + local index receipt"},
    {"id": "data:ads-dashboard", "name": "Google Ads 儀表板", "status": "declared", "description": "Google Ads 資料寫入與分析面；圖表與即時新鮮度需另行驗證。", "path": "google-sheet:1bVcYTSjxSLLHf1SApJg5fbpPyX5RGv_LMTfKOqMl6-I", "owner": "A3", "used_by": ["A2", "A3", "A1"], "freshness": "platform + Sheet readback"},
    {"id": "data:a2-patrol", "name": "A2 Ads SEO Patrol Matrix", "status": "verified", "description": "SEO／Ads／WordPress 巡查工作資料與 approval-ready 追蹤。", "path": "google-sheet:1mUig-TrkbAMNSHngV-sJ3cPqs-5gGLkTH1cjpkyK0Vs", "owner": "A2", "used_by": ["A1", "A2", "A3"], "freshness": "live sources override Sheet notes"},
    {"id": "data:asset-index-local", "name": "MAPLAB_WORKSPACE 素材索引", "status": "verified", "description": "婚禮／企業／生日／甜點素材索引、原始庫與 PNG 救回紀錄。", "path": "/Volumes/MacExternal/MAPLAB_WORKSPACE/index", "owner": "A4", "used_by": ["A2", "A3", "A4", "A6", "A8"], "freshness": "index validation receipts"},
    {"id": "data:task-index", "name": "Task／Role generated indexes", "status": "verified", "description": "任務索引、角色模組關聯與跨來源反向索引。", "path": "workbook/task_index.json", "owner": "A1", "used_by": ["A0", "A1", "all runtimes"], "outputs": ["impact analysis", "cold-start navigation"], "freshness": "generated_at + source hashes"}
  ],
  "workflows": [
    {
      "id": "workflow:A2", "owner_role": "A2", "name": "WordPress／SEO 案例工作流", "purpose": "把已核准事實與素材做成可發布、可回讀的搜尋內容。",
      "stages": [
        {"id": "A2-01", "name": "內容機會", "inputs": ["GSC/GA/Ads evidence", "content inventory", "Owner priority"], "actions": ["找搜尋與案例 gap", "確認不與既有頁 cannibalize"], "outputs": ["content opportunity brief"], "acceptance": ["來源、日期、搜尋意圖清楚"], "tools": ["GSC", "GA", "WordPress REST", "A2 patrol matrix"], "approval_gate": null, "handoff_to": ["A2-02", "A3"], "evidence": ["review brief"]},
        {"id": "A2-02", "name": "事實與素材查核", "inputs": ["content opportunity brief", "customer-approved facts", "A4 asset index"], "actions": ["品牌記憶檢查", "live URL/REST 查核", "授權與隱私篩選"], "outputs": ["approved case brief", "asset request"], "acceptance": ["verified/inference/missing 分層", "無未核准客戶名稱與私密資訊"], "tools": ["WordPress REST", "Drive metadata", "brand skills"], "approval_gate": null, "handoff_to": ["A2-03", "A4", "A8-01"], "evidence": ["source bridge", "brand memory check"]},
        {"id": "A2-03", "name": "文章草稿", "inputs": ["approved case brief", "keyword/intent", "brand voice"], "actions": ["撰寫案例與 CTA", "建立內連與 FAQ"], "outputs": ["article draft", "SEO title/description draft"], "acceptance": ["文案無 AI 慣用說服句", "CTA 與公開事實正確"], "tools": ["writing skill", "content audit"], "approval_gate": null, "handoff_to": ["A2-04", "A8-02"], "evidence": ["draft bundle"]},